{"cid_profile":{"base":"base32","codec":"dag-cbor","hash":"sha2-256","name":"mcp.cidprofile.default","normalization":{"path_separator":"/","reject_symlinks":true,"sort_entries":true,"strip_owner":true,"strip_permissions":true,"strip_timestamps":true},"version":"1"},"descriptor_cid":"bafybeigdyrzt5sfp7udm7hu76uh7y26nf3efuylqabf3oclgtqy55fbzdi","entries":[{"blob_cid":"bafkreigaknpexyvxt76zgkitavbwx6ejgfheup5oybpm77f3pxzrvwpfdi","executable":false,"path":"dist/tool.js","size_bytes":512},{"blob_cid":"bafkreihdwdcefgh4dqkjv67uzcmw7ojee6xedzdetojuzjevtenxquvyku","executable":false,"path":"package.json","size_bytes":256}],"root_cid":"bafybeigdyrzt5sfp7udm7hu76uh7y26nf3efuylqabf3oclgtqy55fbzdi","schema_version":"toolbundle.manifest.v0.1"}