{
  "schema_version": "toolbundle.manifest.v0.1",
  "cid_profile": {
    "name": "mcp.cidprofile.default",
    "version": "1",
    "hash": "sha2-256",
    "codec": "dag-cbor",
    "base": "base32",
    "normalization": {
      "path_separator": "/",
      "sort_entries": true,
      "strip_timestamps": true,
      "strip_owner": true,
      "strip_permissions": true,
      "reject_symlinks": true
    }
  },
  "descriptor_cid": "bafybeigdyrzt5sfp7udm7hu76uh7y26nf3efuylqabf3oclgtqy55fbzdi",
  "entries": [
    {
      "path": "dist/tool.js",
      "blob_cid": "bafkreigaknpexyvxt76zgkitavbwx6ejgfheup5oybpm77f3pxzrvwpfdi",
      "size_bytes": 512,
      "executable": false
    },
    {
      "path": "package.json",
      "blob_cid": "bafkreihdwdcefgh4dqkjv67uzcmw7ojee6xedzdetojuzjevtenxquvyku",
      "size_bytes": 256,
      "executable": false
    }
  ],
  "root_cid": "bafybeigdyrzt5sfp7udm7hu76uh7y26nf3efuylqabf3oclgtqy55fbzdi"
}
